{
  "$schema": "http://json-schema.org/draft-07/schema#",
  "title": "Task Object Schema (Separated Architecture)",
  "description": "Minimal task object with references to external files (tests, workflow, plan)",
  "type": "object",
  "required": ["id", "version", "content", "activeForm", "description", "status", "testSuiteRef", "workflowRef"],
  "properties": {
    "id": {
      "type": "string",
      "pattern": "^P\\d+-[A-Z]+-T\\d+$",
      "description": "Task ID in format P{phase}-{feature}-T{number}, e.g., P2-PROF-T1"
    },
    "version": {
      "type": "string",
      "pattern": "^\\d+\\.\\d+$",
      "description": "Semantic version, e.g., 1.0, 1.1, 2.0"
    },
    "content": {
      "type": "string",
      "minLength": 10,
      "description": "Imperative form: 'Complete JWT utils implementation and testing'"
    },
    "activeForm": {
      "type": "string",
      "minLength": 10,
      "description": "Present continuous form: 'Completing JWT utils implementation and testing'"
    },
    "description": {
      "type": "string",
      "minLength": 20,
      "description": "Detailed description of what this task accomplishes"
    },
    "status": {
      "type": "string",
      "enum": ["pending", "in_progress", "completed", "blocked"],
      "description": "Current task status"
    },
    "testSuiteRef": {
      "type": "string",
      "pattern": "^tests/[a-zA-Z0-9-]+\\.json$",
      "description": "Reference to test suite file, e.g., 'tests/task-3-tests.json'"
    },
    "workflowRef": {
      "type": "string",
      "pattern": "^workflows/[a-z-]+\\.json$",
      "description": "Reference to workflow template, e.g., 'workflows/tdd.json'"
    },
    "planningResultRef": {
      "type": "string",
      "pattern": "^plans/[a-zA-Z0-9-]+\\.json$",
      "description": "Optional reference to planning result file, e.g., 'plans/task-3-plan.json'"
    },
    "dependencies": {
      "type": "array",
      "items": {
        "type": "string",
        "pattern": "^P\\d+-[A-Z]+-T\\d+$"
      },
      "description": "Array of task IDs that must be completed before this task"
    },
    "blockers": {
      "type": "array",
      "items": {
        "type": "string"
      },
      "description": "Array of blocker descriptions preventing task progress"
    },
    "tags": {
      "type": "array",
      "items": {
        "type": "string"
      },
      "description": "Tags for categorization: ['user-service', 'GET', 'profiles']"
    },
    "estimatedDuration": {
      "type": "string",
      "description": "Human-readable duration estimate, e.g., '90-120 min'"
    }
  }
}
